{
  "id": "prose-template-example",
  "description": "The methodology template's example is two paragraphs.",
  "function": "parse_prose",
  "input": "The OECD collects activity-level reports from each DAC member, ...\\n\\nA second paragraph if needed.\\n",
  "expect": "The OECD collects activity-level reports from each DAC member, ...\n\nA second paragraph if needed."
}
