{
  "id": "transformations-crlf-line-endings",
  "description": "CRLF line endings parse the same as LF.",
  "function": "parse_transformations",
  "input": "## Step\\r\\n\\r\\nOne\\r\\ntwo.\\r\\n\\r\\n- a\\r\\n- b\\r\\n",
  "expect": [
    {
      "title": "Step",
      "description": "One two.\n\n- a\n- b"
    }
  ]
}
