{
  "id": "transformations-crs",
  "description": "The CRS transformations document parses into its five steps.",
  "function": "parse_transformations",
  "input": "## Download the source data\\n\\nThe complete CRS file is downloaded from the OECD each time the pipeline runs, and\\nreplaces the previous copy, so the data reflects the OECD's latest release.\\n\\n## Exclude donor core contributions to multilaterals\\n\\nThe OECD instructs that donor core contributions to multilateral organisations,\\nreported as ordinary CRS rows flagged `bi_multi = 2`, are excluded to compute\\nbilateral flows. These contributions are already reported in Members' Total Use of\\nthe Multilateral System, so keeping them would double count.\\n\\n## Standardise providers and recipients\\n\\nProvider and recipient codes are standardised to Data Commons IDs used across the\\nplatform, so data can be compared across datasets.\\n\\n## Select dimensions\\n\\nEvery figure is reported against the year, the provider and the recipient, and four\\ndimensions from the CRS: type of flow, co-operation modality, type of finance and\\npurpose code. The CRS describes each activity in far more detail than this, including\\nproject titles, descriptions, channels and policy markers, none of which is carried\\nthrough.\\n\\n## Aggregate totals\\n\\nActivities sharing the same year, provider, recipient and dimensions are summed.\\nCommitments, disbursements, net disbursements and grant equivalents are each\\naggregated as separate measures. Every figure is reported in US dollars at current\\nprices.\\n",
  "expect": [
    {
      "title": "Download the source data",
      "description": "The complete CRS file is downloaded from the OECD each time the pipeline runs, and replaces the previous copy, so the data reflects the OECD's latest release."
    },
    {
      "title": "Exclude donor core contributions to multilaterals",
      "description": "The OECD instructs that donor core contributions to multilateral organisations, reported as ordinary CRS rows flagged `bi_multi = 2`, are excluded to compute bilateral flows. These contributions are already reported in Members' Total Use of the Multilateral System, so keeping them would double count."
    },
    {
      "title": "Standardise providers and recipients",
      "description": "Provider and recipient codes are standardised to Data Commons IDs used across the platform, so data can be compared across datasets."
    },
    {
      "title": "Select dimensions",
      "description": "Every figure is reported against the year, the provider and the recipient, and four dimensions from the CRS: type of flow, co-operation modality, type of finance and purpose code. The CRS describes each activity in far more detail than this, including project titles, descriptions, channels and policy markers, none of which is carried through."
    },
    {
      "title": "Aggregate totals",
      "description": "Activities sharing the same year, provider, recipient and dimensions are summed. Commitments, disbursements, net disbursements and grant equivalents are each aggregated as separate measures. Every figure is reported in US dollars at current prices."
    }
  ]
}
