{
  "id": "transformations-template-example",
  "description": "The template's example parses into two steps with inline Markdown kept.",
  "function": "parse_transformations",
  "input": "## Download the source data\\n\\nWhat this step does and why, in one or more paragraphs. `Code spans`,\\n*emphasis* and [links](https://example.org) are fine.\\n\\n## Exclude donor core contributions to multilaterals\\n\\nThe next step.\\n",
  "expect": [
    {
      "title": "Download the source data",
      "description": "What this step does and why, in one or more paragraphs. `Code spans`, *emphasis* and [links](https://example.org) are fine."
    },
    {
      "title": "Exclude donor core contributions to multilaterals",
      "description": "The next step."
    }
  ]
}
