{
  "id": "notes-template-example",
  "description": "The notes template's example is two notes.",
  "function": "parse_notes",
  "input": "- Figures for the latest year are preliminary and revised the following spring.\\n- Private flows are reported by a subset of providers only.\\n",
  "expect": [
    "Figures for the latest year are preliminary and revised the following spring.",
    "Private flows are reported by a subset of providers only."
  ]
}
